St. šk.,Obec,Stredná škola,Ulica
710261730,Martin,Spojená škola súkromná-Súkromná škola umeleckého priemyslu,J. Lettricha 3
161233,Svidník,Gymnázium duklianskych hrdinov,Komenského 16
618462,Svidník,Stredná zdravotnícka škola milosrdného Samaritána,Sovietskych hrdinov 80
893692,Svidník,Stredná odborná škola polytechnická a služieb arm. gen. Ludvíka Svobodu,Bardejovská 715/18
710261101,Svidník,Spojená škola-Obchodná akadémia,Centrálna 464
52915654,Svidník,Škola umeleckého priemyslu,Sovietskych hrdinov 369/24
17151481,Podolínec,Stredná odborná škola sv. Klementa Hofbauera,Kláštorná 2
161217,Stará Ľubovňa,Gymnázium Terézie Vansovej,17. novembra 6
37945785,Stará Ľubovňa,Cirkevné gymnázium sv. Mikuláša,Štúrova 383/3
17050405,Stará Ľubovňa,Stredná odborná škola technická,Levočská 40
710274653,Stará Ľubovňa,Spojená škola-Obchodná akadémia,Jarmočná 132
710274645,Stará Ľubovňa,Spojená škola-Stredná odborná škola hotelových služieb a remesiel,Jarmočná 108
17050316,Šurany,Stredná odborná škola technická,Nitrianska 61
17050138,Šurany,Gymnázium,Bernolákova 37
161951,Šurany,Obchodná akadémia,Nám. hrdinov 7
42114977,Šurany,Stredná odborná škola gastronómie a služieb,Hviezdoslavova 55
17050227,Bánovce nad Bebravou,Gymnázium Janka Jesenského,Radlinského 665/2
37922459,Bánovce nad Bebravou,Stredná odborná škola strojnícka,Partizánska cesta 76
52089291,Bánovce nad Bebravou,Cirkevná stredná odborná škola sv.Terézie z Lisieux,Farská 5
160296,Partizánske,Gymnázium,Komenského 2/1074
50424891,Partizánske,Stredná odborná škola Jána Antonína Baťu,Nám. SNP 5
891835,Krásno nad Kysucou,Stredná odborná škola drevárska a stavebná,Krásno nad Kysucou 1642
160849,Turzovka,Gymnázium,Ľ. Štúra 35
695041,Čadca,Stredná odborná škola obchodu a služieb,Ul. 17. novembra 2579
891452,Čadca,Stredná odborná škola technická,Okružná 693
160563,Čadca,Gymnázium Jozefa Miloslava Hurbana,17. novembra 1296
162043,Čadca,Obchodná akadémia Dušana Metoda Janotu,17. novembra 2701
614866,Čadca,Stredná odborná škola pedagogická sv. Márie Goretti,Horná 137
17059852,Čadca,Stredná zdravotnícka škola sv. Františka z Assisi,Horná 137
160652,Kysucké Nové Mesto,Gymnázium,Jesenského 2243
17053722,Kysucké Nové Mesto,Stredná odborná škola strojnícka,Športová 1326
51906201,Kysucké Nové Mesto,Stredná priemyselná škola informačných technológií,Nábrežná 1325
158518,Dolný Kubín,Stredná odborná škola obchodu a služieb,Pelhřimovská 1186/10
160571,Dolný Kubín,Gymnázium Pavla Országha Hviezdoslava,Hviezdoslavovo nám. 18
162051,Dolný Kubín,Obchodná akadémia,Radlinského 1725/55
607045,Dolný Kubín,Stredná zdravotnícka škola,M. Hattalu 2149
891479,Dolný Kubín,Stredná odborná škola polytechnická,Jelšavská 404
42070902,Dolný Kubín,Súkromná stredná odborná škola,SNP 1202/14
710261802,Dolný Kubín,Spojená škola cirkevná-Cirkevné gymnázium Andreja Radlinského,Okružná 2062/25
710216467,Nižná,Spojená škola-Škola umeleckého priemyslu,Hattalova 471
710261659,Nižná,Spojená škola-Stredná odborná škola technická,Hattalova 471
161225,Stropkov,Gymnázium,Konštantínova 1751/64
37947915,Stropkov,Stredná odborná škola elektrotechnická,Hviezdoslavova 44
627844,Sučany,Bilingválne gymnázium Milana Hodžu,Komenského 215
710261756,Vrútky,Spojená škola-Gymnázium Jozefa Cígera Hronského,M. R. Štefánika 1
162817,Turčianske Teplice,Stredná odborná škola pedagogická,SNP 509/116
710221940,Turčianske Teplice,Spojená škola-Gymnázium Mikuláša Galandu,Horné Rakovce 1440/29
160628,Dubnica nad Váhom,Gymnázium,Školská 2
161586,Dubnica nad Váhom,Stredná priemyselná škola,Obrancov mieru 343/1
42026393,Dubnica nad Váhom,Stredná odborná škola technická,Bratislavská 439/18
710213638,Nová Dubnica,Spojená škola sv. Jána Bosca-Gymnázium sv. Jána Bosca,Trenčianska 66/28
710237723,Nová Dubnica,Spojená škola sv. Jána Bosca-Stredná odborná škola informačných technológií  sv. Jána Bosca,Trenčianska 66/28
159298,Pruské,Stredná odborná škola,Pruské 294
17050561,Považská Bystrica,Stredná odborná škola strojnícka,Športovcov 341/2
160741,Považská Bystrica,Gymnázium,Školská 234/8
161594,Považská Bystrica,Stredná priemyselná škola,Ulica slovenských partizánov 1132/52
162086,Považská Bystrica,Obchodná akadémia,Jesenského 259/6
607002,Považská Bystrica,Stredná zdravotnícka škola,Školská 230
42142768,Považská Bystrica,Súkromná hotelová akadémia,M. R. Štefánika 147
42142750,Považská Bystrica,Súkromná obchodná akadémia,M. R. Štefánika 147
42141443,Považská Bystrica,Stredná odborná škola,Ulica slovenských partizánov 1129/49
158569,Púchov,Stredná odborná škola obchodu a služieb,Ul. 1. mája 1264
160768,Púchov,Gymnázium,Ul. 1. mája 905
710272715,Púchov,Spojená škola-Stredná odborná škola,I. Krasku 491
710272669,Púchov,Spojená škola-Stredná odborná škola sklárska,I. Krasku 491
